{
  "schema": "8x8.proof-receipt.v0.1",
  "proof_id": "PROOF.example.service.20260801",
  "proof_type": "PROOF_OF_SERVICE",
  "proof_class": "SERVICE",
  "issuer_id": "NODE.example.service",
  "subject_id": "SERVICE.example.health-canary",
  "verifier_id": "VERIFIER.example.protocol",
  "relying_party_id": "8x8.protocol.fixture",
  "policy_digest": "aaaaaaaaaaaaaaaaaaaaaaaaaaaaaaaaaaaaaaaaaaaaaaaaaaaaaaaaaaaaaaaa",
  "code_digest": "bbbbbbbbbbbbbbbbbbbbbbbbbbbbbbbbbbbbbbbbbbbbbbbbbbbbbbbbbbbbbbbb",
  "evidence_commitments": ["cccccccccccccccccccccccccccccccccccccccccccccccccccccccccccccccc"],
  "claims": {"service_level":"SIMULATED_CANARY","latency_ms":1},
  "issued_at": "2026-08-01T23:30:00Z",
  "expires_at": "2026-08-02T23:30:00Z",
  "nonce": "fixture-nonce-00000001",
  "verification_result": "PASS",
  "reason_codes": ["SIMULATED_FIXTURE_PASS"],
  "privacy_classification": "PUBLIC",
  "reward_eligibility": "SIMULATED",
  "dispute_state": "NONE",
  "revocation_state": "ACTIVE",
  "previous_proof_digest": null,
  "receipt_digest": "dddddddddddddddddddddddddddddddddddddddddddddddddddddddddddddddd"
}
